,CVE_ID,Overview,CVSS_V3,CVSS_V2,References,vulnerable_software_versions,CWE
0,CVE-2019-18464,"In Progress MOVEit Transfer 10.2 before 10.2.6 (2018.3), 11.0 before 11.0.4 (2019.0.4), and 11.1 before 11.1.3 (2019.1.3), multiple SQL Injection vulnerabilities have been found in the REST API that could allow an unauthenticated attacker to gain unauthorized access to the database. Depending on the database engine being used (MySQL, Microsoft SQL Server, or Azure SQL), an attacker may be able to infer information about the structure and contents of the database or may be able to alter the database.",9.8,7.5,https://community.ipswitch.com/s/article/SQL-Injection-Vulnerability-2|https://docs.ipswitch.com/MOVEit/Transfer2018SP2/ReleaseNotes/en/index.htm#46490.htm|https://docs.ipswitch.com/MOVEit/Transfer2019/ReleaseNotes/en/index.htm#48648.htm|https://docs.ipswitch.com/MOVEit/Transfer2019_1/ReleaseNotes/en/index.htm#49443.htm,cpe:2.3:a:ipswitch:moveit_transfer:*:*:*:*:*:*:*:*|cpe:2.3:a:ipswitch:moveit_transfer:*:*:*:*:*:*:*:*|cpe:2.3:a:ipswitch:moveit_transfer:*:*:*:*:*:*:*:*,CWE-89
1,CVE-2018-18813,"The Spotfire web server component of TIBCO Software Inc.'s TIBCO Spotfire Analytics Platform for AWS Marketplace, and TIBCO Spotfire Server contains multiple vulnerabilities that may allow persistent and reflected cross-site scripting attacks. Affected releases are TIBCO Software Inc. TIBCO Spotfire Analytics Platform for AWS Marketplace: versions up to and including 10.0.0, and TIBCO Spotfire Server: versions up to and including 7.10.1; 7.11.0; 7.11.1; 7.12.0; 7.13.0; 7.14.0; 10.0.0.",6.1,4.3,http://www.securityfocus.com/bid/106635|http://www.tibco.com/services/support/advisories|https://www.tibco.com/support/advisories/2019/01/tibco-security-advisory-january-16-2019-tibco-spotfire-2018-18813,cpe:2.3:a:tibco:spotfire_analytics_platform_for_aws:*:*:*:*:*:*:*:*|cpe:2.3:a:tibco:spotfire_server:*:*:*:*:*:*:*:*|cpe:2.3:a:tibco:spotfire_server:7.11.0:*:*:*:*:*:*:*|cpe:2.3:a:tibco:spotfire_server:7.11.1:*:*:*:*:*:*:*|cpe:2.3:a:tibco:spotfire_server:7.12.0:*:*:*:*:*:*:*|cpe:2.3:a:tibco:spotfire_server:7.13.0:*:*:*:*:*:*:*|cpe:2.3:a:tibco:spotfire_server:7.14.0:*:*:*:*:*:*:*|cpe:2.3:a:tibco:spotfire_server:10.0.0:*:*:*:*:*:*:*,CWE-79
2,CVE-2018-18809,"The default server implementation of TIBCO Software Inc.'s TIBCO JasperReports Library, TIBCO JasperReports Library Community Edition, TIBCO JasperReports Library for ActiveMatrix BPM, TIBCO JasperReports Server, TIBCO JasperReports Server Community Edition, TIBCO JasperReports Server for ActiveMatrix BPM, TIBCO Jaspersoft for AWS with Multi-Tenancy, and TIBCO Jaspersoft Reporting and Analytics for AWS contains a directory-traversal vulnerability that may theoretically allow web server users to access contents of the host system. Affected releases are TIBCO Software Inc.'s TIBCO JasperReports Library: versions up to and including 6.3.4; 6.4.1; 6.4.2; 6.4.21; 7.1.0; 7.2.0, TIBCO JasperReports Library Community Edition: versions up to and including 6.7.0, TIBCO JasperReports Library for ActiveMatrix BPM: versions up to and including 6.4.21, TIBCO JasperReports Server: versions up to and including 6.3.4; 6.4.0; 6.4.1; 6.4.2; 6.4.3; 7.1.0, TIBCO JasperReports Server Community Edition: versions up to and including 6.4.3; 7.1.0, TIBCO JasperReports Server for ActiveMatrix BPM: versions up to and including 6.4.3, TIBCO Jaspersoft for AWS with Multi-Tenancy: versions up to and including 7.1.0, TIBCO Jaspersoft Reporting and Analytics for AWS: versions up to and including 7.1.0.",6.5,4.0,http://packetstormsecurity.com/files/154406/Tibco-JasperSoft-Path-Traversal.html|http://seclists.org/fulldisclosure/2019/Sep/17|http://www.securityfocus.com/bid/107351|http://www.tibco.com/services/support/advisories|https://security.elarlang.eu/cve-2018-18809-path-traversal-in-tibco-jaspersoft.html|https://www.tibco.com/support/advisories/2019/03/tibco-security-advisory-march-6-2019-tibco-jasperreports-library-2018-18809,cpe:2.3:a:tibco:jasperreports_library:6.3.4:*:*:*:*:*:*:*|cpe:2.3:a:tibco:jasperreports_library:6.4.1:*:*:*:*:*:*:*|cpe:2.3:a:tibco:jasperreports_library:6.4.2:*:*:*:*:*:*:*|cpe:2.3:a:tibco:jasperreports_library:6.4.21:*:*:*:*:*:*:*|cpe:2.3:a:tibco:jasperreports_library:*:*:*:*:activematrix_bpm:*:*:*|cpe:2.3:a:tibco:jasperreports_library:*:*:*:*:community:*:*:*|cpe:2.3:a:tibco:jasperreports_library:7.1.0:*:*:*:*:*:*:*|cpe:2.3:a:tibco:jasperreports_library:7.2.0:*:*:*:*:*:*:*|cpe:2.3:a:tibco:jasperreports_server:6.3.4:*:*:*:*:*:*:*|cpe:2.3:a:tibco:jasperreports_server:6.4.0:*:*:*:*:*:*:*|cpe:2.3:a:tibco:jasperreports_server:6.4.1:*:*:*:*:*:*:*|cpe:2.3:a:tibco:jasperreports_server:6.4.2:*:*:*:*:*:*:*|cpe:2.3:a:tibco:jasperreports_server:6.4.3:*:*:*:*:*:*:*|cpe:2.3:a:tibco:jasperreports_server:*:*:*:*:*:activematrix_bpm:*:*|cpe:2.3:a:tibco:jasperreports_server:*:*:*:*:community:*:*:*|cpe:2.3:a:tibco:jasperreports_server:7.1.0:*:*:*:*:*:*:*|cpe:2.3:a:tibco:jasperreports_server:7.1.0:*:*:*:community:*:*:*|cpe:2.3:a:tibco:jaspersoft:*:*:*:*:*:aws_with_multi-tenancy:*:*|cpe:2.3:a:tibco:jaspersoft_reporting_and_analytics:*:*:*:*:*:aws:*:*,CWE-22
3,CVE-2019-19316,"When using the Azure backend with a shared access signature (SAS), Terraform versions prior to 0.12.17 may transmit the token and state snapshot using cleartext HTTP.",7.5,4.3,https://github.com/hashicorp/terraform/security/advisories/GHSA-4rvg-555h-r626,cpe:2.3:a:hashicorp:terraform:*:*:*:*:*:*:*:*,CWE-327
4,CVE-2015-4554,"Multiple unspecified vulnerabilities in TIBCO Spotfire Client and Spotfire Web Player Client in Spotfire Analyst before 5.5.2, 6.0.x before 6.0.3, 6.5.x before 6.5.3, and 7.0.x before 7.0.1; Spotfire Analytics Platform for AWS 6.5 and 7.0.x before 7.0.1; Spotfire Automation Services before 5.5.2, 6.0.x before 6.0.3, 6.5.x before 6.5.3, and 7.0.x before 7.0.1; Spotfire Deployment Kit before 5.5.2, 6.0.x before 6.0.3, 6.5.x before 6.5.3, and 7.0.x before 7.0.1; Spotfire Desktop before 6.5.2 and 7.0.x before 7.0.1; Spotfire Desktop Language Packs 7.0.x before 7.0.1; Spotfire Professional before 5.5.2, 6.0.x before 6.0.3, 6.5.x before 6.5.3, and 7.0.x before 7.0.1; Spotfire Web Player before 5.5.2, 6.0.x before 6.0.3, 6.5.x before 6.5.3, and 7.0.x before 7.0.1; and Silver Fabric Enabler for Spotfire Web Player before 2.1.1 allow remote attackers to execute arbitrary code or obtain sensitive information via unknown vectors.",,7.5,http://www.securitytracker.com/id/1033015|http://www.tibco.com/assets/blt1fd126faba191a9f/2015-001-advisory.txt|http://www.tibco.com/mk/advisory.jsp,cpe:2.3:a:tibco:spotfire_deployment_kit:*:*:*:*:*:*:*:*|cpe:2.3:a:tibco:spotfire_deployment_kit:6.0.0:*:*:*:*:*:*:*|cpe:2.3:a:tibco:spotfire_deployment_kit:6.0.1:*:*:*:*:*:*:*|cpe:2.3:a:tibco:spotfire_deployment_kit:6.0.2:*:*:*:*:*:*:*|cpe:2.3:a:tibco:spotfire_deployment_kit:6.5.0:*:*:*:*:*:*:*|cpe:2.3:a:tibco:spotfire_deployment_kit:6.5.1:*:*:*:*:*:*:*|cpe:2.3:a:tibco:spotfire_deployment_kit:6.5.2:*:*:*:*:*:*:*|cpe:2.3:a:tibco:spotfire_deployment_kit:7.0.0:*:*:*:*:*:*:*|cpe:2.3:a:tibco:spotfire_professional:*:*:*:*:*:*:*:*|cpe:2.3:a:tibco:spotfire_professional:6.0.0:*:*:*:*:*:*:*|cpe:2.3:a:tibco:spotfire_professional:6.0.1:*:*:*:*:*:*:*|cpe:2.3:a:tibco:spotfire_professional:6.0.2:*:*:*:*:*:*:*|cpe:2.3:a:tibco:spotfire_professional:6.5.0:*:*:*:*:*:*:*|cpe:2.3:a:tibco:spotfire_professional:6.5.1:*:*:*:*:*:*:*|cpe:2.3:a:tibco:spotfire_professional:6.5.2:*:*:*:*:*:*:*|cpe:2.3:a:tibco:spotfire_professional:7.0.0:*:*:*:*:*:*:*|cpe:2.3:a:tibco:spotfire_web_player:*:*:*:*:*:*:*:*|cpe:2.3:a:tibco:spotfire_web_player:6.0.0:*:*:*:*:*:*:*|cpe:2.3:a:tibco:spotfire_web_player:6.0.1:*:*:*:*:*:*:*|cpe:2.3:a:tibco:spotfire_web_player:6.0.2:*:*:*:*:*:*:*|cpe:2.3:a:tibco:spotfire_web_player:6.5.0:*:*:*:*:*:*:*|cpe:2.3:a:tibco:spotfire_web_player:6.5.1:*:*:*:*:*:*:*|cpe:2.3:a:tibco:spotfire_web_player:6.5.2:*:*:*:*:*:*:*|cpe:2.3:a:tibco:spotfire_web_player:7.0.0:*:*:*:*:*:*:*|cpe:2.3:a:tibco:spotfire_desktop:*:*:*:*:*:*:*:*|cpe:2.3:a:tibco:spotfire_desktop:7.0.0:*:*:*:*:*:*:*|cpe:2.3:a:tibco:spotfire_desktop_language_packs:7.0.0:*:*:*:*:*:*:*|cpe:2.3:a:tibco:spotfire_automation_services:*:*:*:*:*:*:*:*|cpe:2.3:a:tibco:spotfire_automation_services:6.0.0:*:*:*:*:*:*:*|cpe:2.3:a:tibco:spotfire_automation_services:6.0.1:*:*:*:*:*:*:*|cpe:2.3:a:tibco:spotfire_automation_services:6.0.2:*:*:*:*:*:*:*|cpe:2.3:a:tibco:spotfire_automation_services:6.5.0:*:*:*:*:*:*:*|cpe:2.3:a:tibco:spotfire_automation_services:6.5.1:*:*:*:*:*:*:*|cpe:2.3:a:tibco:spotfire_automation_services:6.5.2:*:*:*:*:*:*:*|cpe:2.3:a:tibco:spotfire_automation_services:7.0.0:*:*:*:*:*:*:*|cpe:2.3:a:tibco:spotfire_analyst:*:*:*:*:*:*:*:*|cpe:2.3:a:tibco:spotfire_analyst:6.0.0:*:*:*:*:*:*:*|cpe:2.3:a:tibco:spotfire_analyst:6.0.1:*:*:*:*:*:*:*|cpe:2.3:a:tibco:spotfire_analyst:6.0.2:*:*:*:*:*:*:*|cpe:2.3:a:tibco:spotfire_analyst:6.5.0:*:*:*:*:*:*:*|cpe:2.3:a:tibco:spotfire_analyst:6.5.1:*:*:*:*:*:*:*|cpe:2.3:a:tibco:spotfire_analyst:6.5.2:*:*:*:*:*:*:*|cpe:2.3:a:tibco:spotfire_analyst:7.0.0:*:*:*:*:*:*:*|cpe:2.3:a:tibco:silver_fabric_enabler_for_spotfire_webplayer:2.1.0:*:*:*:*:*:*:*|cpe:2.3:a:tibco:spotfire_analytics_platform_for_aws:6.5:*:*:*:*:*:*:*|cpe:2.3:a:tibco:spotfire_analytics_platform_for_aws:7.0.0:*:*:*:*:*:*:*,NVD-CWE-noinfo
5,CVE-2020-0758,"An elevation of privilege vulnerability exists when Azure DevOps Server and Team Foundation Services improperly handle pipeline job tokens, aka 'Azure DevOps Server and Team Foundation Services Elevation of Privilege Vulnerability'. This CVE ID is unique from CVE-2020-0815.",7.5,6.0,https://portal.msrc.microsoft.com/en-US/security-guidance/advisory/CVE-2020-0758,cpe:2.3:a:microsoft:team_foundation_server:2017:update3.1:*:*:*:*:*:*|cpe:2.3:a:microsoft:team_foundation_server:2018:update1.2:*:*:*:*:*:*|cpe:2.3:a:microsoft:team_foundation_server:2018:update3.2:*:*:*:*:*:*|cpe:2.3:o:microsoft:azure_devops_server:2019:update1:*:*:*:*:*:*|cpe:2.3:o:microsoft:azure_devops_server:2019:update1.1:*:*:*:*:*:*|cpe:2.3:o:microsoft:azure_devops_server:2019.0.1:*:*:*:*:*:*:*,CWE-269
6,CVE-2019-10421,"Jenkins Azure Event Grid Build Notifier Plugin stores credentials unencrypted in job config.xml files on the Jenkins master where they can be viewed by users with Extended Read permission, or access to the master file system.",4.3,4.0,http://www.openwall.com/lists/oss-security/2019/09/25/3|https://jenkins.io/security/advisory/2019-09-25/#SECURITY-1544,cpe:2.3:a:jenkins:azure_event_grid_notifier:*:*:*:*:*:jenkins:*:*,CWE-312
7,CVE-2019-0869,"A spoofing vulnerability exists in Microsoft Azure DevOps Server when it fails to properly handle web requests, aka 'Azure DevOps Server HTML Injection Vulnerability'.",6.1,4.3,http://www.securityfocus.com/bid/107768|https://portal.msrc.microsoft.com/en-US/security-guidance/advisory/CVE-2019-0869,cpe:2.3:o:microsoft:azure_devops_server:2019:*:*:*:*:*:*:*,CWE-74
8,CVE-2020-9410,"The report generator component of TIBCO Software Inc.'s TIBCO JasperReports Library, TIBCO JasperReports Library for ActiveMatrix BPM, TIBCO JasperReports Server, TIBCO JasperReports Server for AWS Marketplace, and TIBCO JasperReports Server for ActiveMatrix BPM contains a vulnerability that theoretically allows an attacker to exploit HTML injection to gain full control of a web interface containing the output of the report generator component with the privileges of any user that views the affected report(s). The attacker can theoretically exploit this vulnerability when other users view a maliciously generated report, where those reports use Fusion Charts and a data source with contents controlled by the attacker. Affected releases are TIBCO Software Inc.'s TIBCO JasperReports Library: versions 7.1.1 and below, versions 7.2.0 and 7.2.1, version 7.3.0, version 7.5.0, TIBCO JasperReports Library for ActiveMatrix BPM: versions 7.1.1 and below, TIBCO JasperReports Server: versions 7.1.1 and below, version 7.2.0, version 7.5.0, TIBCO JasperReports Server for AWS Marketplace: versions 7.5.0 and below, and TIBCO JasperReports Server for ActiveMatrix BPM: versions 7.1.1 and below.",8.8,6.8,http://www.tibco.com/services/support/advisories,cpe:2.3:a:tibco:jasperreports_library:*:*:*:*:*:-:*:*|cpe:2.3:a:tibco:jasperreports_library:*:*:*:*:*:activematrix_bpm:*:*|cpe:2.3:a:tibco:jasperreports_library:7.2.0:*:*:*:*:*:*:*|cpe:2.3:a:tibco:jasperreports_library:7.2.1:*:*:*:*:*:*:*|cpe:2.3:a:tibco:jasperreports_library:7.3.0:*:*:*:*:*:*:*|cpe:2.3:a:tibco:jasperreports_library:7.5.0:*:*:*:*:*:*:*|cpe:2.3:a:tibco:jasperreports_server:*:*:*:*:*:-:*:*|cpe:2.3:a:tibco:jasperreports_server:*:*:*:*:*:activematrix_bpm:*:*|cpe:2.3:a:tibco:jasperreports_server:7.2.0:*:*:*:*:*:*:*|cpe:2.3:a:tibco:jasperreports_server:7.5.0:*:*:*:*:*:*:*|cpe:2.3:a:tibco:jasperreports_server:*:*:*:*:*:aws_marketplace:*:*,CWE-74
9,CVE-2018-16603,"An issue was discovered in Amazon Web Services (AWS) FreeRTOS through 1.3.1, FreeRTOS up to V10.0.1 (with FreeRTOS+TCP), and WITTENSTEIN WHIS Connect middleware TCP/IP component. Out of bounds access to TCP source and destination port fields in xProcessReceivedTCPPacket can leak data back to an attacker.",5.9,4.3,https://blog.zimperium.com/freertos-tcpip-stack-vulnerabilities-details/|https://blog.zimperium.com/freertos-tcpip-stack-vulnerabilities-put-wide-range-devices-risk-compromise-smart-homes-critical-infrastructure-systems/|https://github.com/aws/amazon-freertos/blob/v1.3.2/CHANGELOG.md,cpe:2.3:a:amazon:amazon_web_services_freertos:*:*:*:*:*:*:*:*|cpe:2.3:a:amazon:freertos:*:*:*:*:*:*:*:*,CWE-200
10,CVE-2018-1000403,Jenkins project Jenkins AWS CodeDeploy Plugin version 1.19 and earlier contains a Insufficiently Protected Credentials vulnerability in AWSCodeDeployPublisher.java that can result in Credentials Disclosure. This attack appear to be exploitable via local file access. This vulnerability appears to have been fixed in 1.20 and later.,7.8,2.1,https://jenkins.io/security/advisory/2018-06-25/#SECURITY-833,cpe:2.3:a:jenkins:aws_codedeploy:*:*:*:*:*:jenkins:*:*,CWE-522
11,CVE-2008-3684,"Heap-based buffer overflow in aws_tmxn.exe in the Admin Agent service in the server in EMC Documentum ApplicationXtender Workflow, possibly 5.40 SP1 and earlier, allows remote attackers to execute arbitrary code via crafted packet data to TCP port 2606.",,10.0,http://secunia.com/advisories/37070|http://www.zerodayinitiative.com/advisories/ZDI-08-096/,cpe:2.3:a:emc:documentum_applicationxtender:*:sp1:*:*:*:*:*:*,CWE-119
12,CVE-2020-5575,"Cross-site scripting vulnerability in Movable Type series (Movable Type 7 r.4606 (7.2.1) and earlier (Movable Type 7), Movable Type Advanced 7 r.4606 (7.2.1) and earlier (Movable Type Advanced 7), Movable Type for AWS 7 r.4606 (7.2.1) and earlier (Movable Type for AWS 7), Movable Type 6.5.3 and earlier (Movable Type 6.5), Movable Type Advanced 6.5.3 and earlier (Movable Type Advanced 6.5), Movable Type 6.3.11 and earlier (Movable Type 6.3), Movable Type Advanced 6.3.11 and earlier (Movable Type 6.3), Movable Type Premium 1.29 and earlier, and Movable Type Premium Advanced 1.29 and earlier) allows remote attackers to inject arbitrary script or HTML via unspecified vectors.",6.1,4.3,https://jvn.jp/en/jp/JVN28806943/index.html|https://movabletype.org/news/2020/05/mt-730-660-6312-released.html,cpe:2.3:a:sixapart:movable_type:*:*:*:*:advanced:*:*:*|cpe:2.3:a:sixapart:movable_type:*:*:*:*:premium:*:*:*|cpe:2.3:a:sixapart:movable_type:*:*:*:*:-:*:*:*|cpe:2.3:a:sixapart:movable_type:*:*:*:*:advanced:*:*:*|cpe:2.3:a:sixapart:movable_type:*:*:*:*:-:*:*:*|cpe:2.3:a:sixapart:movable_type:*:*:*:*:advanced:*:*:*|cpe:2.3:a:sixapart:movable_type:*:*:*:*:*:aws:*:*|cpe:2.3:a:sixapart:movable_type:*:*:*:*:-:*:*:*|cpe:2.3:a:sixapart:movable_type:*:*:*:*:advanced:*:*:*,CWE-79
13,CVE-2018-16600,"An issue was discovered in Amazon Web Services (AWS) FreeRTOS through 1.3.1, FreeRTOS up to V10.0.1 (with FreeRTOS+TCP), and WITTENSTEIN WHIS Connect middleware TCP/IP component. Out of bounds memory access during parsing of ARP packets in eARPProcessPacket can be used for information disclosure.",5.9,4.3,https://blog.zimperium.com/freertos-tcpip-stack-vulnerabilities-details/|https://blog.zimperium.com/freertos-tcpip-stack-vulnerabilities-put-wide-range-devices-risk-compromise-smart-homes-critical-infrastructure-systems/|https://github.com/aws/amazon-freertos/blob/v1.3.2/CHANGELOG.md,cpe:2.3:a:amazon:amazon_web_services_freertos:*:*:*:*:*:*:*:*|cpe:2.3:a:amazon:freertos:*:*:*:*:*:*:*:*,CWE-200
14,CVE-2017-14705,"DenyAll WAF before 6.4.1 allows unauthenticated remote command execution via TCP port 3001 because shell metacharacters can be inserted into the type parameter to the tailDateFile function in /webservices/stream/tail.php. An iToken authentication parameter is required but can be obtained by exploiting CVE-2017-14706. This affects DenyAll i-Suite LTS 5.5.0 through 5.5.12, i-Suite 5.6, Web Application Firewall 5.7, and Web Application Firewall 6.x before 6.4.1, with On Premises or AWS/Azure cloud deployments.",8.1,9.3,https://github.com/rapid7/metasploit-framework/pull/8980|https://pentest.blog/advisory-denyall-web-application-firewall-unauthenticated-remote-code-execution/|https://www.denyall.com/blog/advisories/advisory-unauthenticated-remote-code-execution-denyall-web-application-firewall/,cpe:2.3:a:denyall:i-suite:5.5.0:*:*:*:lts:*:*:*|cpe:2.3:a:denyall:i-suite:5.5.9:*:*:*:lts:*:*:*|cpe:2.3:a:denyall:i-suite:5.5.10:*:*:*:lts:*:*:*|cpe:2.3:a:denyall:i-suite:5.5.11:*:*:*:lts:*:*:*|cpe:2.3:a:denyall:i-suite:5.5.12:*:*:*:lts:*:*:*|cpe:2.3:a:denyall:i-suite:5.6.0:*:*:*:lts:*:*:*|cpe:2.3:a:denyall:web_application_firewall:5.7.0:*:*:*:*:*:*:*|cpe:2.3:a:denyall:web_application_firewall:6.0.0:*:*:*:*:*:*:*|cpe:2.3:a:denyall:web_application_firewall:6.1.0:*:*:*:*:*:*:*|cpe:2.3:a:denyall:web_application_firewall:6.2.0:*:*:*:*:*:*:*|cpe:2.3:a:denyall:web_application_firewall:6.3.0:*:*:*:*:*:*:*|cpe:2.3:a:denyall:web_application_firewall:6.4.0:*:*:*:*:*:*:*,CWE-78
15,CVE-2015-3373,"The Amazon AWS module before 7.x-1.3 for Drupal uses the base URL and AWS access key to generate the access token, which makes it easier for remote attackers to guess the token value and create backups via a crafted URL.",,5.0,http://cgit.drupalcode.org/aws_amazon/commit/?id=9377a26|http://www.openwall.com/lists/oss-security/2015/01/29/6|http://www.securityfocus.com/bid/74277|https://www.drupal.org/node/2415457|https://www.drupal.org/node/2415873,cpe:2.3:a:amazon_aws_project:amazon_aws:*:*:*:*:*:drupal:*:*,CWE-200
16,CVE-2019-8989,"The application server component of TIBCO Software Inc.'s TIBCO Data Science for AWS, and TIBCO Spotfire Data Science contains a vulnerability that theoretically enables a user to spoof their account to look like a different user in the affected system. Affected releases are TIBCO Software Inc.'s TIBCO Data Science for AWS: versions up to and including 6.4.0, and TIBCO Spotfire Data Science: versions up to and including 6.4.0.",4.3,4.0,http://www.securityfocus.com/bid/107608|http://www.tibco.com/services/support/advisories|https://www.tibco.com/support/advisories/2019/03/tibco-security-advisory-march-26-2019-tibco-spotfire-data-science-2019-8989,cpe:2.3:a:tibco:data_science_for_aws:*:*:*:*:*:*:*:*|cpe:2.3:a:tibco:spotfire_data_science:*:*:*:*:*:*:*:*,CWE-20
17,CVE-2019-17336,"The Data access layer component of TIBCO Software Inc.'s TIBCO Spotfire Analytics Platform for AWS Marketplace and TIBCO Spotfire Server contains multiple vulnerabilities that theoretically allow an attacker access to information that can lead to obtaining credentials used to access Spotfire data sources. The attacker would need privileges to save a Spotfire file to the library, and only applies in a situation where NTLM credentials, or a credentials profile is in use. Affected releases are TIBCO Software Inc.'s TIBCO Spotfire Analytics Platform for AWS Marketplace: version 10.6.0 and TIBCO Spotfire Server: versions 7.11.7 and below, versions 7.12.0, 7.13.0, 7.14.0, 10.0.0, 10.0.1, 10.1.0, 10.2.0, 10.2.1, 10.3.0, 10.3.1, 10.3.2, 10.3.3, and 10.3.4, versions 10.4.0, 10.5.0, and 10.6.0.",6.5,4.0,http://www.tibco.com/services/support/advisories|https://www.tibco.com/support/advisories/2019/12/tibco-security-advisory-december-17-2019-tibco-spotfire-2019-17336,cpe:2.3:a:tibco:spotfire_analytics_platform_for_aws:10.6.0:*:*:*:*:*:*:*|cpe:2.3:a:tibco:spotfire_server:*:*:*:*:*:*:*:*|cpe:2.3:a:tibco:spotfire_server:7.12.0:*:*:*:*:*:*:*|cpe:2.3:a:tibco:spotfire_server:7.13.0:*:*:*:*:*:*:*|cpe:2.3:a:tibco:spotfire_server:7.14.0:*:*:*:*:*:*:*|cpe:2.3:a:tibco:spotfire_server:10.0.0:*:*:*:*:*:*:*|cpe:2.3:a:tibco:spotfire_server:10.0.1:*:*:*:*:*:*:*|cpe:2.3:a:tibco:spotfire_server:10.1.0:*:*:*:*:*:*:*|cpe:2.3:a:tibco:spotfire_server:10.2.0:*:*:*:*:*:*:*|cpe:2.3:a:tibco:spotfire_server:10.2.1:*:*:*:*:*:*:*|cpe:2.3:a:tibco:spotfire_server:10.3.0:*:*:*:*:*:*:*|cpe:2.3:a:tibco:spotfire_server:10.3.1:*:*:*:*:*:*:*|cpe:2.3:a:tibco:spotfire_server:10.3.2:*:*:*:*:*:*:*|cpe:2.3:a:tibco:spotfire_server:10.3.3:*:*:*:*:*:*:*|cpe:2.3:a:tibco:spotfire_server:10.3.4:*:*:*:*:*:*:*|cpe:2.3:a:tibco:spotfire_server:10.4.0:*:*:*:*:*:*:*|cpe:2.3:a:tibco:spotfire_server:10.5.0:*:*:*:*:*:*:*|cpe:2.3:a:tibco:spotfire_server:10.6.0:*:*:*:*:*:*:*,CWE-522
18,CVE-2020-2090,A cross-site request forgery vulnerability in Jenkins Amazon EC2 Plugin 1.47 and earlier allows attackers to connect to an attacker-specified URL within the AWS region using attacker-specified credentials IDs obtained through another method.,8.8,6.8,https://jenkins.io/security/advisory/2020-01-15/#SECURITY-1004,cpe:2.3:a:jenkins:amazon_ec2:*:*:*:*:*:jenkins:*:*,CWE-352
19,CVE-2019-0857,"A spoofing vulnerability that could allow a security feature bypass exists in when Azure DevOps Server does not properly sanitize user provided input, aka 'Azure DevOps Server Spoofing Vulnerability'.",6.5,4.3,http://www.securityfocus.com/bid/107760|https://portal.msrc.microsoft.com/en-US/security-guidance/advisory/CVE-2019-0857,cpe:2.3:o:microsoft:azure_devops_server:2019:*:*:*:*:*:*:*,CWE-20
20,CVE-2017-9655,"A Cross-Site Scripting issue was discovered in OSIsoft PI Integrator for Business Analytics before 2016 R2, PI Integrator for Microsoft Azure before 2016 R2 SP1, and PI Integrator for SAP HANA before 2017. An attacker may be able to upload a malicious script that attempts to redirect users to a malicious web site.",5.4,3.5,http://www.securityfocus.com/bid/100212|https://ics-cert.us-cert.gov/advisories/ICSA-17-220-01|https://techsupport.osisoft.com/Troubleshooting/Alerts/AL00324,cpe:2.3:a:osisoft:pi_integrator_for_business_analystics:*:*:*:*:*:*:*:*|cpe:2.3:a:osisoft:pi_integrator_for_microsoft_azure:*:*:*:*:*:*:*:*|cpe:2.3:a:osisoft:pi_integrator_for_sap_hana:*:*:*:*:*:*:*:*,CWE-79
21,CVE-2019-11210,"The server component of TIBCO Software Inc.'s TIBCO Enterprise Runtime for R - Server Edition, and TIBCO Spotfire Analytics Platform for AWS Marketplace contains a vulnerability that theoretically allows an unauthenticated user to bypass access controls and remotely execute code using the operating system account hosting the affected component. This issue affects: TIBCO Enterprise Runtime for R - Server Edition versions 1.2.0 and below, and TIBCO Spotfire Analytics Platform for AWS Marketplace versions 10.4.0 and 10.5.0.",10.0,10.0,http://www.tibco.com/services/support/advisories|https://www.tibco.com/support/advisories/2019/09/tibco-security-advisory-september-17-2019-tibco-enterprise-runtime-for-r-server-2019-11210,cpe:2.3:a:tibco:enterprise_runtime_for_r:*:*:*:*:server:*:*:*|cpe:2.3:a:tibco:spotfire_analytics_platform_for_aws:10.4.0:*:*:*:*:*:*:*|cpe:2.3:a:tibco:spotfire_analytics_platform_for_aws:10.5.0:*:*:*:*:*:*:*,CWE-20
22,CVE-2008-3685,"Directory traversal vulnerability in aws_tmxn.exe in the Admin Agent service in the server in EMC Documentum ApplicationXtender Workflow, possibly 5.40 SP1 and earlier, allows remote attackers to upload arbitrary files, and execute arbitrary code, via directory traversal sequences in requests to TCP port 2606.",,10.0,http://secunia.com/advisories/37070|http://www.zerodayinitiative.com/advisories/ZDI-08-095/,cpe:2.3:a:emc:documentum_applicationxtender_workflow_manager:*:sp1:*:*:*:*:*:*,CWE-22
23,CVE-2019-10777,"In aws-lambda versions prior to version 1.0.5, the ""config.FunctioName"" is used to construct the argument used within the ""exec"" function without any sanitization. It is possible for a user to inject arbitrary commands to the ""zipCmd"" used within ""config.FunctionName"".",9.8,7.5,https://snyk.io/vuln/SNYK-JS-AWSLAMBDA-540839,cpe:2.3:a:amazon:aws-lambda:*:*:*:*:*:*:*:*,CWE-78
